{
 "areas": [
  {
   "id": "w60006.0.0",
   "kind": "grass",
   "name": "North Bank",
   "triangles": [
    2,
    3,
    0,
    2,
    0,
    1
   ],
   "vertices": [
    [
     0.0,
     -30.38
    ],
    [
     256.02,
     -30.38
    ],
    [
     256.02,
     -0.0
    ],
    [
     0.0,
     -0.0
    ]
   ]
  }
 ],
 "bushes": [
  [
   15.24,
   61.98,
   -365.03,
   "bush_round",
   0.88,
   0.53,
   2630480,
   "frontage"
  ],
  [
   21.69,
   61.93,
   -365.03,
   "bush_low",
   0.83,
   0.74,
   2630481,
   "frontage"
  ],
  [
   28.13,
   61.88,
   -365.08,
   "bush_round",
   1.1,
   0.66,
   2630482,
   "frontage"
  ],
  [
   30.63,
   61.85,
   -370.22,
   "bush_low",
   0.73,
   0.66,
   2630483,
   "frontage"
  ],
  [
   28.03,
   61.83,
   -388.2,
   "bush_round",
   1.48,
   0.89,
   2630486,
   "frontage"
  ],
  [
   21.58,
   61.89,
   -388.2,
   "bush_low",
   0.58,
   0.52,
   2630487,
   "frontage"
  ],
  [
   15.13,
   61.96,
   -388.2,
   "bush_round",
   1.02,
   0.61,
   2630488,
   "frontage"
  ],
  [
   9.66,
   62.05,
   -386.19,
   "bush_low",
   0.55,
   0.49,
   2630489,
   "frontage"
  ],
  [
   9.41,
   62.07,
   -379.79,
   "bush_round",
   1.48,
   0.89,
   2630490,
   "frontage"
  ],
  [
   9.41,
   62.08,
   -373.33,
   "bush_low",
   0.88,
   0.79,
   2630491,
   "frontage"
  ],
  [
   9.7,
   62.08,
   -366.94,
   "bush_round",
   0.9,
   0.54,
   2630492,
   "frontage"
  ],
  [
   15.24,
   62.01,
   -341.08,
   "bush_round",
   1.54,
   0.92,
   2630611,
   "frontage"
  ],
  [
   21.69,
   61.95,
   -341.08,
   "bush_low",
   0.54,
   0.49,
   2630612,
   "frontage"
  ],
  [
   28.14,
   61.9,
   -341.12,
   "bush_round",
   1.47,
   0.88,
   2630613,
   "frontage"
  ],
  [
   30.63,
   61.88,
   -346.27,
   "bush_low",
   0.59,
   0.54,
   2630614,
   "frontage"
  ],
  [
   30.63,
   61.88,
   -352.72,
   "bush_round",
   0.82,
   0.49,
   2630615,
   "frontage"
  ],
  [
   30.63,
   61.87,
   -359.17,
   "bush_low",
   0.87,
   0.79,
   2630616,
   "frontage"
  ],
  [
   28.03,
   61.87,
   -364.25,
   "bush_round",
   1.14,
   0.68,
   2630617,
   "frontage"
  ],
  [
   21.58,
   61.93,
   -364.25,
   "bush_low",
   0.84,
   0.75,
   2630618,
   "frontage"
  ],
  [
   15.13,
   61.99,
   -364.25,
   "bush_round",
   0.97,
   0.58,
   2630619,
   "frontage"
  ],
  [
   9.66,
   62.09,
   -362.24,
   "bush_low",
   0.51,
   0.46,
   2630620,
   "frontage"
  ],
  [
   9.41,
   62.1,
   -355.84,
   "bush_round",
   1.4,
   0.84,
   2630621,
   "frontage"
  ],
  [
   9.41,
   62.11,
   -349.38,
   "bush_low",
   0.6,
   0.54,
   2630622,
   "frontage"
  ],
  [
   9.7,
   62.11,
   -342.99,
   "bush_round",
   1.49,
   0.89,
   2630623,
   "frontage"
  ],
  [
   15.24,
   62.01,
   -317.13,
   "bush_round",
   1.11,
   0.67,
   2630742,
   "frontage"
  ],
  [
   21.69,
   61.95,
   -317.13,
   "bush_low",
   0.69,
   0.62,
   2630743,
   "frontage"
  ],
  [
   28.14,
   61.9,
   -317.17,
   "bush_round",
   1.25,
   0.75,
   2630744,
   "frontage"
  ],
  [
   30.63,
   61.88,
   -322.32,
   "bush_low",
   0.56,
   0.5,
   2630745,
   "frontage"
  ],
  [
   30.63,
   61.89,
   -328.77,
   "bush_round",
   1.13,
   0.68,
   2630746,
   "frontage"
  ],
  [
   30.63,
   61.89,
   -335.22,
   "bush_low",
   0.66,
   0.59,
   2630747,
   "frontage"
  ],
  [
   28.03,
   61.89,
   -340.29,
   "bush_round",
   1.08,
   0.65,
   2630748,
   "frontage"
  ],
  [
   21.58,
   61.95,
   -340.29,
   "bush_low",
   0.84,
   0.75,
   2630749,
   "frontage"
  ],
  [
   15.13,
   62.01,
   -340.29,
   "bush_round",
   0.99,
   0.6,
   2630750,
   "frontage"
  ],
  [
   9.66,
   62.11,
   -338.29,
   "bush_low",
   0.55,
   0.49,
   2630751,
   "frontage"
  ],
  [
   9.41,
   62.12,
   -331.88,
   "bush_round",
   1.11,
   0.67,
   2630752,
   "frontage"
  ],
  [
   9.41,
   62.12,
   -325.43,
   "bush_low",
   0.53,
   0.48,
   2630753,
   "frontage"
  ],
  [
   9.7,
   62.11,
   -319.04,
   "bush_round",
   1.4,
   0.84,
   2630754,
   "frontage"
  ]
 ],
 "columns": [
  "x",
  "y",
  "z",
  "archetype",
  "height",
  "crown",
  "seed",
  "source"
 ],
 "schema_version": 0,
 "trees": [
  [
   6.05,
   62.06,
   -390.65,
   "broadleaf",
   11.61,
   4.06,
   60013111,
   "row"
  ],
  [
   14.06,
   61.96,
   -390.65,
   "broadleaf",
   8.06,
   2.82,
   60013112,
   "row"
  ],
  [
   22.06,
   61.89,
   -390.65,
   "broadleaf",
   11.18,
   3.91,
   60013113,
   "row"
  ],
  [
   30.06,
   61.82,
   -390.65,
   "broadleaf",
   10.26,
   3.59,
   60013114,
   "row"
  ],
  [
   38.06,
   61.76,
   -390.65,
   "broadleaf",
   9.09,
   3.18,
   60013115,
   "row"
  ],
  [
   46.06,
   61.69,
   -390.65,
   "broadleaf",
   13.62,
   4.77,
   60013116,
   "row"
  ],
  [
   54.06,
   61.62,
   -390.65,
   "broadleaf",
   8.64,
   3.02,
   60013117,
   "row"
  ],
  [
   62.06,
   61.56,
   -390.65,
   "broadleaf",
   11.47,
   4.01,
   60013118,
   "row"
  ],
  [
   70.06,
   61.5,
   -390.65,
   "broadleaf",
   9.9,
   3.46,
   60013119,
   "row"
  ],
  [
   78.06,
   61.44,
   -390.65,
   "broadleaf",
   11.65,
   4.08,
   60013120,
   "row"
  ],
  [
   86.07,
   61.39,
   -390.65,
   "broadleaf",
   7.4,
   2.59,
   60013121,
   "row"
  ],
  [
   94.07,
   61.34,
   -390.65,
   "broadleaf",
   7.46,
   2.61,
   60013122,
   "row"
  ],
  [
   102.07,
   61.28,
   -390.65,
   "broadleaf",
   12.13,
   4.25,
   60013123,
   "row"
  ],
  [
   110.07,
   61.26,
   -390.65,
   "broadleaf",
   7.58,
   2.65,
   60013124,
   "row"
  ],
  [
   118.07,
   61.25,
   -390.65,
   "broadleaf",
   7.67,
   2.69,
   60013125,
   "row"
  ],
  [
   126.07,
   61.23,
   -390.65,
   "broadleaf",
   11.2,
   3.92,
   60013126,
   "row"
  ],
  [
   134.07,
   61.2,
   -390.65,
   "broadleaf",
   9.22,
   3.23,
   60013127,
   "row"
  ],
  [
   142.07,
   61.19,
   -390.65,
   "broadleaf",
   8.28,
   2.9,
   60013128,
   "row"
  ],
  [
   150.07,
   61.18,
   -390.65,
   "broadleaf",
   13.9,
   4.86,
   60013129,
   "row"
  ],
  [
   158.08,
   61.16,
   -390.65,
   "broadleaf",
   7.13,
   2.5,
   60013130,
   "row"
  ],
  [
   166.08,
   61.15,
   -390.65,
   "broadleaf",
   7.15,
   2.5,
   60013131,
   "row"
  ],
  [
   174.08,
   61.14,
   -390.65,
   "broadleaf",
   7.1,
   2.49,
   60013132,
   "row"
  ],
  [
   182.08,
   61.13,
   -390.65,
   "broadleaf",
   10.91,
   3.82,
   60013133,
   "row"
  ],
  [
   190.08,
   61.11,
   -390.65,
   "broadleaf",
   13.94,
   4.88,
   60013134,
   "row"
  ],
  [
   206.08,
   61.1,
   -390.65,
   "broadleaf",
   12.05,
   4.22,
   60013136,
   "row"
  ],
  [
   214.08,
   61.12,
   -390.65,
   "broadleaf",
   11.97,
   4.19,
   60013137,
   "row"
  ],
  [
   222.09,
   61.13,
   -390.65,
   "broadleaf",
   11.2,
   3.92,
   60013138,
   "row"
  ],
  [
   230.09,
   61.13,
   -390.65,
   "broadleaf",
   8.27,
   2.89,
   60013139,
   "row"
  ],
  [
   238.09,
   61.14,
   -390.65,
   "broadleaf",
   10.8,
   3.78,
   60013140,
   "row"
  ],
  [
   246.09,
   61.15,
   -390.65,
   "broadleaf",
   8.84,
   3.09,
   60013141,
   "row"
  ],
  [
   254.09,
   61.16,
   -390.65,
   "broadleaf",
   7.81,
   2.73,
   60013142,
   "row"
  ],
  [
   6.05,
   62.02,
   -408.61,
   "broadleaf",
   8.03,
   2.81,
   60014111,
   "row"
  ],
  [
   14.06,
   61.94,
   -408.61,
   "broadleaf",
   10.45,
   3.66,
   60014112,
   "row"
  ],
  [
   22.06,
   61.86,
   -408.61,
   "broadleaf",
   7.89,
   2.76,
   60014113,
   "row"
  ],
  [
   30.06,
   61.8,
   -408.61,
   "broadleaf",
   8.83,
   3.09,
   60014114,
   "row"
  ],
  [
   38.06,
   61.73,
   -408.62,
   "broadleaf",
   11.4,
   3.99,
   60014115,
   "row"
  ],
  [
   46.06,
   61.67,
   -408.62,
   "broadleaf",
   13.43,
   4.7,
   60014116,
   "row"
  ],
  [
   54.06,
   61.61,
   -408.62,
   "broadleaf",
   7.27,
   2.55,
   60014117,
   "row"
  ],
  [
   62.06,
   61.55,
   -408.62,
   "broadleaf",
   9.92,
   3.47,
   60014118,
   "row"
  ],
  [
   70.06,
   61.49,
   -408.62,
   "broadleaf",
   10.82,
   3.79,
   60014119,
   "row"
  ],
  [
   78.06,
   61.42,
   -408.62,
   "broadleaf",
   9.45,
   3.31,
   60014120,
   "row"
  ],
  [
   86.07,
   61.36,
   -408.62,
   "broadleaf",
   10.25,
   3.59,
   60014121,
   "row"
  ],
  [
   94.07,
   61.32,
   -408.62,
   "broadleaf",
   12.89,
   4.51,
   60014122,
   "row"
  ],
  [
   102.07,
   61.28,
   -408.62,
   "broadleaf",
   11.29,
   3.95,
   60014123,
   "row"
  ],
  [
   110.07,
   61.26,
   -408.62,
   "broadleaf",
   11.02,
   3.86,
   60014124,
   "row"
  ],
  [
   118.07,
   61.24,
   -408.62,
   "broadleaf",
   7.97,
   2.79,
   60014125,
   "row"
  ],
  [
   126.07,
   61.21,
   -408.62,
   "broadleaf",
   9.9,
   3.46,
   60014126,
   "row"
  ],
  [
   134.07,
   61.19,
   -408.62,
   "broadleaf",
   13.62,
   4.77,
   60014127,
   "row"
  ],
  [
   142.07,
   61.18,
   -408.62,
   "broadleaf",
   13.25,
   4.64,
   60014128,
   "row"
  ],
  [
   150.07,
   61.17,
   -408.62,
   "broadleaf",
   12.83,
   4.49,
   60014129,
   "row"
  ],
  [
   158.08,
   61.15,
   -408.62,
   "broadleaf",
   12.72,
   4.45,
   60014130,
   "row"
  ],
  [
   166.08,
   61.14,
   -408.62,
   "broadleaf",
   8.06,
   2.82,
   60014131,
   "row"
  ],
  [
   174.08,
   61.13,
   -408.62,
   "broadleaf",
   10.42,
   3.65,
   60014132,
   "row"
  ],
  [
   182.08,
   61.12,
   -408.62,
   "broadleaf",
   9.19,
   3.22,
   60014133,
   "row"
  ],
  [
   190.08,
   61.11,
   -408.62,
   "broadleaf",
   13.4,
   4.69,
   60014134,
   "row"
  ],
  [
   206.08,
   61.1,
   -408.62,
   "broadleaf",
   8.72,
   3.05,
   60014136,
   "row"
  ],
  [
   214.08,
   61.12,
   -408.62,
   "broadleaf",
   11.32,
   3.96,
   60014137,
   "row"
  ],
  [
   222.08,
   61.12,
   -408.62,
   "broadleaf",
   7.69,
   2.69,
   60014138,
   "row"
  ],
  [
   230.09,
   61.13,
   -408.62,
   "broadleaf",
   10.62,
   3.72,
   60014139,
   "row"
  ],
  [
   238.09,
   61.14,
   -408.62,